question,answer,category,keywords
"Where is BYV located?","Our engineering headquarters is located at Level 5, Bashundhara Residential Area, Dhaka 1229, Bangladesh. We serve clients globally via our cloud-first infrastructure.","location","address, office, dhaka, bangladesh, location"
"What is your contact email?","You can reach our engineering team directly at contact@byvbd.com. For urgent project discussions, we recommend booking a consultation call directly through this chat.","contact","email, mail, reach, contact, support"
"How much does a custom website or platform cost?","Custom enterprise-grade platforms (Next.js) typically range from $3,000 to $8,000 USD. Final pricing depends on complexity, backend integrations, and scale requirements.","pricing","cost, price, website, web, app, mobile"
"What is the price for an AI Agent or RAG system?","AI implementations generally start at $2,500 USD for a standard RAG knowledge base setup. Complex Autonomous Agents or Private Fine-tuned models typically range from $5,000 to $15,000+ USD depending on data volume and logic complexity.","pricing","cost, price, ai, bot, rag, agent, chatbot"
"How long does a project take to build?","Standard benchmark timelines: Digital Infrastructure (2-4 weeks), RAG Systems (3-5 weeks), and Complex Enterprise Agents (8-12 weeks). We operate in 2-week Agile sprints.","timeline","time, long, duration, weeks, deadline"
"Do you offer maintenance or support after launch?","Yes. We offer 'Continuous Intelligence' packages starting at roughly $500/month. This includes server monitoring, security patching, and periodic re-indexing of your AI data to keep it current.","support","maintenance, retainer, monthly, update, help"
"What is your development process?","We follow a strict engineering workflow: 1. Discovery & Technical Audit, 2. Architecture Design, 3. Agile Development (Sprints), and 4. Deployment & CI/CD Handover.","process","workflow, steps, method, how you work"
"Do you sign NDAs (Non-Disclosure Agreements)?","Absolutely. As an enterprise-focused firm, we sign strict NDAs before viewing any proprietary data, code, or internal documents. Your Intellectual Property (IP) remains 100% yours.","legal","nda, privacy, agreement, contract, ip"
"How do I hire BYV?","The first step is a Technical Discovery Call. Please provide your email address in this chat, and I will have our Principal Engineer schedule a 30-minute audit of your requirements.","sales","hire, start, book, meeting, call"